{
  "case_id": "D10",
  "decision": "NEEDS_INFO",
  "next_action": "REQUEST_DOCUMENTS",
  "findings": [
    {
      "code": "MISSING_PO",
      "line_id": null,
      "amount": null,
      "evidence_ids": [
        "INV"
      ]
    }
  ],
  "summary": "Fatura INV-001 geçerli görünüyor ancak purchase_order verisi null; sipariş belgesi olmadan fiyat/miktar karşılaştırması yapılamıyor. Sipariş belgesi talep edilmeli."
}
