{
  "case_id": "D17",
  "decision": "REVIEW",
  "next_action": "REQUEST_HUMAN_REVIEW",
  "findings": [
    {
      "code": "PRICE_OVER",
      "line_id": "L1",
      "amount": "200.00",
      "evidence_ids": [
        "INV:L1",
        "PO:L1"
      ]
    }
  ],
  "summary": "Yapılandırılmış veriye dayalı deterministik referans inceleme; dış işlem yapılmadı."
}
