{
  "case_id": "D15",
  "decision": "NEEDS_INFO",
  "next_action": "REQUEST_DOCUMENTS",
  "findings": [
    {
      "code": "UNIT_MISMATCH",
      "line_id": "L1",
      "amount": null,
      "evidence_ids": [
        "INV:L1",
        "PO:L1"
      ]
    }
  ],
  "summary": "Fatura satırı L1 birimi BOX iken sipariş ve teslimat birimi EA; birim eşleşmediği için inceleme durduruldu ve ek bilgi istendi."
}
