{
  "case_id": "D09",
  "decision": "REVIEW",
  "next_action": "REQUEST_HUMAN_REVIEW",
  "findings": [
    {
      "code": "DUPLICATE_INVOICE",
      "line_id": null,
      "amount": "1000.00",
      "evidence_ids": [
        "INV",
        "HIST:H1"
      ]
    }
  ],
  "summary": "Yapılandırılmış veriye dayalı deterministik referans inceleme; dış işlem yapılmadı."
}
