{
  "case_id": "D12",
  "decision": "NEEDS_INFO",
  "next_action": "REQUEST_DOCUMENTS",
  "findings": [
    {
      "code": "CURRENCY_MISMATCH",
      "line_id": null,
      "amount": null,
      "evidence_ids": [
        "INV",
        "PO"
      ]
    }
  ],
  "summary": "Yapılandırılmış veriye dayalı deterministik referans inceleme; dış işlem yapılmadı."
}
