{
  "case_id": "D07",
  "decision": "REVIEW",
  "next_action": "REQUEST_HUMAN_REVIEW",
  "findings": [
    {
      "code": "UNRECEIVED_QTY",
      "line_id": "L1",
      "amount": "200.00",
      "evidence_ids": [
        "INV:L1",
        "GRN:R1"
      ]
    }
  ],
  "summary": "Yapılandırılmış veriye dayalı deterministik referans inceleme; dış işlem yapılmadı."
}
