{
  "case_id": "D20",
  "decision": "REVIEW",
  "next_action": "REQUEST_HUMAN_REVIEW",
  "findings": [
    {
      "code": "ORDER_QTY_OVER",
      "line_id": "L1",
      "amount": "100.00",
      "evidence_ids": [
        "INV:L1",
        "PO:L1",
        "HIST:H1"
      ]
    },
    {
      "code": "UNRECEIVED_QTY",
      "line_id": "L1",
      "amount": "100.00",
      "evidence_ids": [
        "INV:L1",
        "GRN:R1",
        "HIST:H1"
      ]
    }
  ],
  "summary": "Yapılandırılmış veriye dayalı deterministik referans inceleme; dış işlem yapılmadı."
}
