{
  "case_id": "T03",
  "decision": "REVIEW",
  "next_action": "REQUEST_HUMAN_REVIEW",
  "findings": [
    {
      "code": "UNRECEIVED_QTY",
      "line_id": "L1",
      "amount": "64.00",
      "evidence_ids": [
        "INV:L1",
        "GRN:R1",
        "GRN:R2"
      ]
    }
  ],
  "summary": "Yapılandırılmış veriye dayalı deterministik referans inceleme; dış işlem yapılmadı."
}
